premises_name,premise_address_1,premise_city,premise_state,premise_zip,clean_name,chain_name,business_type,business_type_manual,ollama_category,ollama_confidence,ollama_reason,ollama_raw
JACK IN THE BOX #6826,220 N HOSKINS RD,Charlotte,NC,,JACK IN THE BOX,,other,,fast_food_burger,1.0,Typical fast food restaurant chain known for burgers and quick service,"{""category"":""fast_food_burger"",""confidence"":1.0,""reason"":""Typical fast food restaurant chain known for burgers and quick service""}"
JACK IN THE BOX #6835,7725 PINEVILLE-MATTHEWS RD,Charlotte,NC,,JACK IN THE BOX,,other,,fast_food_burger,1.0,Typical fast food restaurant chain known for burgers and quick service,"{""category"":""fast_food_burger"",""confidence"":1.0,""reason"":""Typical fast food restaurant chain known for burgers and quick service""}"
JACK IN THE BOX #6850,4505 RANDOLPH RD,Charlotte,NC,,JACK IN THE BOX,,other,,fast_food_burger,1.0,Typical fast food restaurant chain known for burgers and quick service,"{""category"":""fast_food_burger"",""confidence"":1.0,""reason"":""Typical fast food restaurant chain known for burgers and quick service""}"
JACK`S CORNER TAP,8301 MAGNOLIA ESTATES DR,Charlotte,NC,,JACK S CORNER TAP,,other,,bar,0.9,"contains ""tap"" in its name, indicating a bar establishment","{""category"":""bar"",""confidence"":0.9,""reason"":""contains \""tap\"" in its name, indicating a bar establishment""}"
JADE DRAGON,7741 COLONY RD,Charlotte,NC,,JADE DRAGON,,other,,other,0.8,Restaurant or food establishment not clearly identified,"{""category"":""other"",""confidence"":0.8,""reason"":""Restaurant or food establishment not clearly identified""}"
JASMINE BUFFET,2305 WESTINGHOUSE BV,Charlotte,NC,,JASMINE BUFFET,,other,,buffet,1.0,establishment is a buffet,"{""category"":""buffet"",""confidence"":1.0,""reason"":""establishment is a buffet""}"
JENIS SPLENDID ICE CREAM BLAKNEY,9828 REA RD,Charlotte,NC,,JENIS SPLENDID ICE CREAM BLAKNEY,,other,,bakery_cafe,0.9,ice cream shop with bakery and cafe features,"{""category"":""bakery_cafe"",""confidence"":0.9,""reason"":""ice cream shop with bakery and cafe features""}"
JENIS SPLENDID ICE CREAM NODA,416 E 36TH ST,Charlotte,NC,,JENIS SPLENDID ICE CREAM NODA,,other,,bakery_cafe,1.0,ice cream shop with bakery/cafe features,"{""category"":""bakery_cafe"",""confidence"":1.0,""reason"":""ice cream shop with bakery/cafe features""}"
JENIS SPLENDID ICE CREAM PARK ROAD,4203 PARK RD,Charlotte,NC,,JENIS SPLENDID ICE CREAM PARK ROAD,,other,,bakery_cafe,1.0,ice cream shop,"{""category"":""bakery_cafe"",""confidence"":1.0,""reason"":""ice cream shop""}"
JENIS SPLENDID ICE CREAM SOUTHEND,1930 CAMDEN RD,Charlotte,NC,,JENIS SPLENDID ICE CREAM SOUTHEND,,other,,bakery_cafe,1.0,ice cream shop with bakery and cafe features,"{""category"":""bakery_cafe"",""confidence"":1.0,""reason"":""ice cream shop with bakery and cafe features""}"
JERSEY MIKE'S #3134,10125 PERIMETER PY,Charlotte,NC,,JERSEY MIKE S,,other,,fast_food_pizza,0.8,Jersey Mike's is a sub sandwich chain that also offers pizza,"{""category"":""fast_food_pizza"",""confidence"":0.8,""reason"":""Jersey Mike's is a sub sandwich chain that also offers pizza""}"
JIMMY  JOHN'S #2154,9130 HARRIS CORNERS PY,Charlotte,NC,,JIMMY JOHN S,,other,,fast_food_burger,1.0,Typical fast food burger establishment name and location,"{""category"":""fast_food_burger"",""confidence"":1.0,""reason"":""Typical fast food burger establishment name and location""}"
JIMMY JOHN'S # 4385,4923 TROJAN DR,Charlotte,NC,,JIMMY JOHN S,,other,,fast_food_burger,1.0,Jimmy John's is a fast food chain known for their sandwiches and burgers,"{""category"":""fast_food_burger"",""confidence"":1.0,""reason"":""Jimmy John's is a fast food chain known for their sandwiches and burgers""}"
JIMMY JOHN'S #2155,9525 BIRKDALE CROSSING DR,Charlotte,NC,,JIMMY JOHN S,,other,,fast_food_burger,1.0,Jimmy John's is a fast food chain known for its sandwiches and burgers,"{""category"":""fast_food_burger"",""confidence"":1.0,""reason"":""Jimmy John's is a fast food chain known for its sandwiches and burgers""}"
JIMMY JOHN'S #2156,19732 WEST CATAWBA AV,Charlotte,NC,,JIMMY JOHN S,,other,,fast_food_burger,1.0,Typical fast food burger joint,"{""category"":""fast_food_burger"",""confidence"":1.0,""reason"":""Typical fast food burger joint""}"
JIMMY JOHN'S #4132 WHITEHALL,7808 S TRYON ST,Charlotte,NC,,JIMMY JOHN S WHITEHALL,,other,,fast_food_burger,1.0,Jimmy John's is a fast-food chain known for its sandwiches and burgers.,"{""category"":""fast_food_burger"",""confidence"":1.0,""reason"":""Jimmy John's is a fast-food chain known for its sandwiches and burgers.""}"
JIMMY JOHN`S #987,3014 DRIWOOD CT,Charlotte,NC,,JIMMY JOHN S,,other,,fast_food_burger,1.0,Jimmy John's is a fast food chain known for its sandwiches and burgers.,"{""category"":""fast_food_burger"",""confidence"":1.0,""reason"":""Jimmy John's is a fast food chain known for its sandwiches and burgers.""}"
"JIMMY, THE",2839 SELWYN AV,Charlotte,NC,,JIMMY,,other,,fast_food_burger,0.8,Typical fast food burger joint,"{""category"":""fast_food_burger"",""confidence"":0.8,""reason"":""Typical fast food burger joint""}"
JIN JIN,14231 MARKET SQUARE DR,Charlotte,NC,,JIN JIN,,other,,grocery_deli,0.9,Establishment name suggests grocery/deli type,"{""category"":""grocery_deli"",""confidence"":0.9,""reason"":""Establishment name suggests grocery/deli type""}"
JJ'S RED HOTS,1514 EAST BV,Charlotte,NC,,JJ S RED HOTS,,other,,fast_food_burger,0.8,Typical fast food burger joint name and location,"{""category"":""fast_food_burger"",""confidence"":0.8,""reason"":""Typical fast food burger joint name and location""}"
JOHNNY BRUSCOS,9515 RIVERBEND VILLAGE DR,Charlotte,NC,,JOHNNY BRUSCOS,,other,,fast_food_chicken,0.8,Chicken focused restaurant,"{""category"":""fast_food_chicken"",""confidence"":0.8,""reason"":""Chicken focused restaurant""}"
JONATHANS,10630 INDEPENDENCE POINTE PY,Charlotte,NC,,JONATHANS,,other,,other,0.8,Restaurant or food establishment not specified in the provided information,"{""category"":""other"",""confidence"":0.8,""reason"":""Restaurant or food establishment not specified in the provided information""}"
JOYS BIRYANI N KABABS,212 N POLK ST,Charlotte,NC,,JOYS BIRYANI N KABABS,,other,,asian_other,0.8,Indian cuisine,"{""category"":""asian_other"",""confidence"":0.8,""reason"":""Indian cuisine""}"
JUAN LOCO,8301 MAGNOLIA ESTATES DR,Charlotte,NC,,JUAN LOCO,,other,,fast_food_mexican,0.8,"Establishment name suggests Mexican food, address and name are consistent with a fast food Mexican restaurant","{""category"":""fast_food_mexican"",""confidence"":0.8,""reason"":""Establishment name suggests Mexican food, address and name are consistent with a fast food Mexican restaurant""}"
JUST FRESH,301 S TRYON ST,Charlotte,NC,,JUST FRESH,,other,,grocery_deli,0.8,Establishment name suggests grocery/deli focus,"{""category"":""grocery_deli"",""confidence"":0.8,""reason"":""Establishment name suggests grocery/deli focus""}"
JUST FRESH #013,5900 QUAIL HOLLOW RD,Charlotte,NC,,JUST FRESH,,other,,fast_food_burger,1.0,Typical fast food burger establishment,"{""category"":""fast_food_burger"",""confidence"":1.0,""reason"":""Typical fast food burger establishment""}"
JUST PLAY,9535 SOUTH BV,Charlotte,NC,,JUST PLAY,,other,,sports_bar,1.0,,"{""category"":""sports_bar"",""confidence"":1.0}"
KABAB 2 GO,4200 SOUTH BV,Charlotte,NC,,KABAB GO,,other,,fast_food_pizza,0.8,"Kabab is a type of Middle Eastern dish, but the '2 Go' suggests a food establishment that also serves pizza","{""category"":""fast_food_pizza"",""confidence"":0.8,""reason"":""Kabab is a type of Middle Eastern dish, but the '2 Go' suggests a food establishment that also serves pizza""}"
KABUTO,1001 E W T HARRIS BV,Charlotte,NC,,KABUTO,,other,,other,0.0,short reason,"{""category"":""other"",""confidence"":0.0,""reason"":""short reason""}"
KABUTO 51 OF CHARLOTTE INC,7724 PINEVILLE-MATTHEWS RD,Charlotte,NC,,KABUTO OF CHARLOTTE,,other,,other,1.0,Establishment is a hotel,"{""category"":""institution"",""confidence"":1.0,""reason"":""Establishment is a hotel""}"
KEN COOKS,430 OLD LITTLE ROCK RD,Charlotte,NC,,KEN COOKS,,other,,other,0.8,Restaurant or food service establishment without clear affiliation to a specific cuisine or type,"{""category"":""other"",""confidence"":0.8,""reason"":""Restaurant or food service establishment without clear affiliation to a specific cuisine or type""}"
KID CASHEW FARMER BUTCHER,1608 EAST BV,Charlotte,NC,,KID CASHEW FARMER BUTCHER,,other,,institutional,1.0,"Establishment is a butcher shop, typically found in institutional settings such as hospitals or schools.","{""category"":""institutional"",""confidence"":1.0,""reason"":""Establishment is a butcher shop, typically found in institutional settings such as hospitals or schools.""}"
KING FISH POKE,350 E MCCULLOUGH DR,Charlotte,NC,,KING FISH POKE,,other,,seafood,1.0,POKE is a type of seafood dish,"{""category"":""seafood"",""confidence"":1.0,""reason"":""POKE is a type of seafood dish""}"
KOZI ITALIAN STREET FOOD,11318 NORTH COMMUNITY HOUSE RD,Charlotte,NC,,KOZI ITALIAN STREET FOOD,,other,,fast_food_mexican,0.8,Italian Street Food typically implies Mexican or Latin American cuisine,"{""category"":""fast_food_mexican"",""confidence"":0.8,""reason"":""Italian Street Food typically implies Mexican or Latin American cuisine""}"
KRAZY CURRY,9101 PINEVILLE-MATTHEWS RD,Charlotte,NC,,KRAZY CURRY,,other,,fast_food_mexican,0.8,Mexican food establishment,"{""category"":""fast_food_mexican"",""confidence"":0.8,""reason"":""Mexican food establishment""}"
KS ASIAN XPRESS,10102 ALBEMARLE RD,Charlotte,NC,,KS ASIAN XPRESS,,other,,asian_chinese,0.8,Asian restaurant name and location,"{""category"":""asian_chinese"",""confidence"":0.8,""reason"":""Asian restaurant name and location""}"
KUNG FOO,8625 LINDHOLM DR,Charlotte,NC,,KUNG FOO,,other,,asian_chinese,1.0,KUNG FOO is a Chinese restaurant name,"{""category"":""asian_chinese"",""confidence"":1.0,""reason"":""KUNG FOO is a Chinese restaurant name""}"
LA BELLE HELENE,300 S TRYON,Charlotte,NC,,LA BELLE HELENE,,other,,bbq,0.8,BBQ joint,"{""category"":""bbq"",""confidence"":0.8,""reason"":""BBQ joint""}"
LA CAPITAL MX,1910 SOUTH BV,Charlotte,NC,,LA CAPITAL MX,,other,,fast_food_mexican,1.0,"normalized name contains 'LA CAPITAL MX', indicating a Mexican fast food establishment","{""category"":""fast_food_mexican"",""confidence"":1.0,""reason"":""normalized name contains 'LA CAPITAL MX', indicating a Mexican fast food establishment""}"
LA CATRACHA,820 E ARROWOOD RD,Charlotte,NC,,LA CATRACHA,,other,,mexican,1.0,LA CATRACHA,"{""category"":""mexican"",""confidence"":1.0,""reason"":""LA CATRACHA""}"
LA FETE,555 S MCDOWELL ST,Charlotte,NC,,LA FETE,,other,,mexican,0.9,LA FETE is a Mexican restaurant based on its name and location.,"{""category"":""mexican"",""confidence"":0.9,""reason"":""LA FETE is a Mexican restaurant based on its name and location.""}"
LA FONDA COLOMBIANA,11329 E INDEPENDENCE BV,Charlotte,NC,,LA FONDA COLOMBIANA,,other,,mexican,1.0,"LA FONDA COLOMBIANA is a Colombian restaurant, indicating it serves Mexican-inspired cuisine.","{""category"":""mexican"",""confidence"":1.0,""reason"":""LA FONDA COLOMBIANA is a Colombian restaurant, indicating it serves Mexican-inspired cuisine.""}"
LA LUNA 2,8829 E W T HARRIS BV,Charlotte,NC,,LA LUNA,,other,,fast_food_mexican,0.8,Mexican food establishment,"{""category"":""fast_food_mexican"",""confidence"":0.8,""reason"":""Mexican food establishment""}"
LA PANADERIA,11229 E INDEPENDENCE BV,Charlotte,NC,,LA PANADERIA,,other,,bakery_cafe,0.9,Establishment name suggests bakery and cafe services,"{""category"":""bakery_cafe"",""confidence"":0.9,""reason"":""Establishment name suggests bakery and cafe services""}"
LA PARISIENNE COCOTTE,9623 BAILEY RD,Charlotte,NC,,LA PARISIENNE COCOTTE,,other,,other,0.8,French bakery and cafe name,"{""category"":""baker_cafe"",""confidence"":0.8,""reason"":""French bakery and cafe name""}"
LA SA SON BY WINTER,4200 SOUTH BV,Charlotte,NC,,LA SA SON BY WINTER,,other,,fast_food_mexican,1.0,LA SA SON BY WINTER is a Mexican fast food establishment,"{""category"":""fast_food_mexican"",""confidence"":1.0,""reason"":""LA SA SON BY WINTER is a Mexican fast food establishment""}"
LA SHISH KABAB,3117 N SHARON AMITY RD,Charlotte,NC,,LA SHISH KABAB,,other,,fast_food_pizza,0.8,"Shish Kabab is a type of Mediterranean dish, but the name and location suggest it may be a fast food pizza place","{""category"":""fast_food_pizza"",""confidence"":0.8,""reason"":""Shish Kabab is a type of Mediterranean dish, but the name and location suggest it may be a fast food pizza place""}"
LA VICTORIA,16139 LANCASTER HY,Charlotte,NC,,LA VICTORIA,,other,,mexican,0.9,normalized name contains 'VICTORIA' which is a common name for Mexican restaurants,"{""category"":""mexican"",""confidence"":0.9,""reason"":""normalized name contains 'VICTORIA' which is a common name for Mexican restaurants""}"
LAI LAI EXPRESS,1607 MONTFORD DR,Charlotte,NC,,LAI LAI EXPRESS,,other,,fast_food_chicken,0.8,Typical fast food chicken establishment,"{""category"":""fast_food_chicken"",""confidence"":0.8,""reason"":""Typical fast food chicken establishment""}"
LAKE NORMAN RESIDENCE INN,16830 KENTON DR,Charlotte,NC,,LAKE NORMAN RESIDENCE INN,,other,,institutional,1.0,Hotel,"{""category"":""institutional"",""confidence"":1.0,""reason"":""Hotel""}"
LANZHOU HAND-PULLED NOODLES,929 PARK CENTER DR,Charlotte,NC,,LANZHOU HAND-PULLED NOODLES,,other,,asian_chinese,1.0,hand-pulled noodles is a traditional Chinese dish,"{""category"":""asian_chinese"",""confidence"":1.0,""reason"":""hand-pulled noodles is a traditional Chinese dish""}"
LAS MARGARITAS,4426 E INDEPENDENCE BV,Charlotte,NC,,LAS MARGARITAS,,other,,fast_food_mexican,1.0,LAS MARGARITAS is a Mexican fast food chain,"{""category"":""fast_food_mexican"",""confidence"":1.0,""reason"":""LAS MARGARITAS is a Mexican fast food chain""}"
LAS MERAS TORTAS,14601 STATESVILLE RD,Charlotte,NC,,LAS MERAS TORTAS,,other,,fast_food_mexican,1.0,LAS MERAS TORTAS is a Mexican fast food establishment,"{""category"":""fast_food_mexican"",""confidence"":1.0,""reason"":""LAS MERAS TORTAS is a Mexican fast food establishment""}"
LAS MERAS TORTAS,5661 FARM POND LN,Charlotte,NC,,LAS MERAS TORTAS,,other,,fast_food_mexican,0.8,Mexican food establishment,"{""category"":""fast_food_mexican"",""confidence"":0.8,""reason"":""Mexican food establishment""}"
LAWRENCE CARIBBEAN,3011 WEST BV,Charlotte,NC,,LAWRENCE CARIBBEAN,,other,,fast_food_mexican,0.8,"Typical Caribbean cuisine is often associated with Mexican or Latin American food, and Lawrence Caribbean has a name suggesting it serves Caribbean dishes.","{""category"":""fast_food_mexican"",""confidence"":0.8,""reason"":""Typical Caribbean cuisine is often associated with Mexican or Latin American food, and Lawrence Caribbean has a name suggesting it serves Caribbean dishes.""}"
LEES HOAGIE HOUSE,15025 LANCASTER HY,Charlotte,NC,,LEES HOAGIE HOUSE,,other,,fast_food_sandwich,0.8,"Typical characteristics of a hoagie house, such as sandwich-focused menu and casual atmosphere.","{""category"":""fast_food_sandwich"",""confidence"":0.8,""reason"":""Typical characteristics of a hoagie house, such as sandwich-focused menu and casual atmosphere.""}"
LEGION BREWING,5610 CARNEGIE BV,Charlotte,NC,,LEGION BREWING,,other,,coffee_shop,1.0,Brewing and coffee-related establishment,"{""category"":""coffee_shop"",""confidence"":1.0,""reason"":""Brewing and coffee-related establishment""}"
LEGION BREWING MOREHEAD,2013 W MOREHEAD ST,Charlotte,NC,,LEGION BREWING MOREHEAD,,other,,bar,1.0,brewery and bar,"{""category"":""bar"",""confidence"":1.0,""reason"":""brewery and bar""}"
LENNY BOY BREWING CO,3000 S TRYON ST,Charlotte,NC,,LENNY BOY BREWING,,other,,bar,1.0,Lenny Boy Brewing Co is a brewery and bar,"{""category"":""bar"",""confidence"":1.0,""reason"":""Lenny Boy Brewing Co is a brewery and bar""}"
LEOS ITALIAN SOCIAL,4720 PIEDMONT ROW DR,Charlotte,NC,,LEOS ITALIAN SOCIAL,,other,,other,1.0,Italian restaurant,"{""category"":""italian"", ""confidence"":1.0, ""reason"":""Italian restaurant""}"
LEROY FOX,705 S SHARON AMITY RD,Charlotte,NC,,LEROY FOX,,other,,other,0.0,No clear indication of food establishment,"{""category"":""other"",""confidence"":0.0,""reason"":""No clear indication of food establishment""}"
LEROY FOX II,1616 CAMDEN RD,Charlotte,NC,,LEROY FOX II,,other,,other,0.0,No information about food establishment found,"{""category"":""other"",""confidence"":0.0,""reason"":""No information about food establishment found""}"
LETS MEAT,1400 S CHURCH ST,Charlotte,NC,,LETS MEAT,,other,,food_truck,1.0,Meat focused food truck,"{""category"":""food_truck"",""confidence"":1.0,""reason"":""Meat focused food truck""}"
LIMANI,6902 PHILLIPS PLACE CT,Charlotte,NC,,LIMANI,,other,,fast_food_burger,0.8,Typical fast food restaurant chain with burger options,"{""category"":""fast_food_burger"",""confidence"":0.8,""reason"":""Typical fast food restaurant chain with burger options""}"
LINK & PIN,9723 SAM FURR RD,Charlotte,NC,,LINK & PIN,,other,,other,0.5,"No clear indication of food type, may be a bar or pub","{""category"":""other"",""confidence"":0.5,""reason"":""No clear indication of food type, may be a bar or pub""}"
LINK & PIN #4102,8128 PROVIDENCE RD,Charlotte,NC,,LINK & PIN,,other,,other,0.5,"No clear indication of food type, possibly a bar or pub","{""category"":""other"",""confidence"":0.5,""reason"":""No clear indication of food type, possibly a bar or pub""}"
LOCAL LOAF EATERY,800 E 35TH ST,Charlotte,NC,,LOCAL LOAF EATERY,,other,,bakery_cafe,0.9,Establishment serves baked goods and has a cafe aspect,"{""category"":""bakery_cafe"",""confidence"":0.9,""reason"":""Establishment serves baked goods and has a cafe aspect""}"
LOCAL THE,105 E 5TH ST,Charlotte,NC,,LOCAL,,other,,other,0.0,short reason,"{""category"":""other"",""confidence"":0.0,""reason"":""short reason""}"
LOCKER ROOM #306-310,800 S MINT ST,Charlotte,NC,,LOCKER ROOM -,,other,,institutional,1.0,"Locker room in a building, likely a school or sports venue","{""category"":""institutional"",""confidence"":1.0,""reason"":""Locker room in a building, likely a school or sports venue""}"
"LODGE, THE",7725 COLONY RD,Charlotte,NC,,LODGE,,other,,institutional,1.0,Hotel,"{""category"":""institutional"",""confidence"":1.0,""reason"":""Hotel""}"
LONDON D'S,832 E 4TH ST,Charlotte,NC,,LONDON D S,,other,,fast_food_burger,0.8,Typical fast food burger joint,"{""category"":""fast_food_burger"",""confidence"":0.8,""reason"":""Typical fast food burger joint""}"
LOONG ASIAN CUISINE,9815 SAM FURR RD,Charlotte,NC,,LOONG ASIAN CUISINE,,other,,asian_chinese,1.0,Chinese restaurant,"{""category"":""asian_chinese"",""confidence"":1.0,""reason"":""Chinese restaurant""}"
LOS CHAMOS CHARLOTTE,7001 SOUTH BV,Charlotte,NC,,LOS CHAMOS CHARLOTTE,,other,,mexican,0.9,establishment name and location suggest Mexican cuisine,"{""category"":""mexican"",""confidence"":0.9,""reason"":""establishment name and location suggest Mexican cuisine""}"
LOS REYES II,7308 E INDEPENDENCE BV,Charlotte,NC,,LOS REYES II,,other,,fast_food_mexican,0.9,Mexican food establishment,"{""category"":""fast_food_mexican"",""confidence"":0.9,""reason"":""Mexican food establishment""}"
LOTUS CUISINE II,4100 CARMEL RD,Charlotte,NC,,LOTUS CUISINE II,,other,,asian_chinese,1.0,Chinese restaurant,"{""category"":""asian_chinese"",""confidence"":1.0,""reason"":""Chinese restaurant""}"
LOVES TRAVEL STOPS & COUNTRY STORES #714,2603 SAM WILSON RD,Charlotte,NC,,LOVES TRAVEL STOPS & COUNTRY STORES,,other,,grocery_deli,0.8,"Establishment appears to be a store selling groceries and deli items, likely a convenience or grocery store.","{""category"":""grocery_deli"",""confidence"":0.8,""reason"":""Establishment appears to be a store selling groceries and deli items, likely a convenience or grocery store.""}"
LUCKY STRIKE,1700 MONTFORD DR,Charlotte,NC,,LUCKY STRIKE,,other,,fast_food_burger,1.0,Typical fast food burger establishment,"{""category"":""fast_food_burger"",""confidence"":1.0,""reason"":""Typical fast food burger establishment""}"
LUCKY STRIKE MATTHEWS,11210 BRIGMAN RD,Charlotte,NC,,LUCKY STRIKE MATTHEWS,,other,,fast_food_burger,0.9,Typical fast food restaurant chain with burger options,"{""category"":""fast_food_burger"",""confidence"":0.9,""reason"":""Typical fast food restaurant chain with burger options""}"
LULABELLES,9335 CENTER LAKE DR,Charlotte,NC,,LULABELLES,,other,,fast_food_mexican,0.8,Mexican food chain,"{""category"":""fast_food_mexican"",""confidence"":0.8,""reason"":""Mexican food chain""}"
LULU'S EXPRESS,2400 TUCKASEEGEE RD,Charlotte,NC,,LULU S EXPRESS,,other,,fast_food_burger,1.0,LULU's Express is a fast-food burger establishment.,"{""category"":""fast_food_burger"",""confidence"":1.0,""reason"":""LULU's Express is a fast-food burger establishment.""}"
MABI COCINA TROPICAL,416 E 36TH ST,Charlotte,NC,,MABI COCINA TROPICAL,,other,,mexican,1.0,MABI COCINA TROPICAL,"{""category"":""mexican"",""confidence"":1.0,""reason"":""MABI COCINA TROPICAL""}"
MAC'S SPEED SHOP-MATTHEWS,142 E JOHN ST,Charlotte,NC,,MAC S SPEED SHOP-MATTHEWS,,other,,food_truck,0.9,"Speed shop is a colloquial term for a food truck or cart, often serving quick and casual meals.","{""category"":""food_truck"",""confidence"":0.9,""reason"":""Speed shop is a colloquial term for a food truck or cart, often serving quick and casual meals.""}"
MACCHU PICCHU,123 MAIN ST,Charlotte,NC,,MACCHU PICCHU,,other,,other,0.0,not a typical food establishment,"{""category"":""other"",""confidence"":0.0,""reason"":""not a typical food establishment""}"
MAC`S SPEED SHOP,19601 LIVERPOOL PY,Charlotte,NC,,MAC S SPEED SHOP,,other,,food_truck,1.0,MAC S SPEED SHOP is a food truck establishment,"{""category"":""food_truck"",""confidence"":1.0,""reason"":""MAC S SPEED SHOP is a food truck establishment""}"
MAC`S SPEED SHOP,2414 SANDY PORTER RD,Charlotte,NC,,MAC S SPEED SHOP,,other,,food_truck,1.0,MAC S SPEED SHOP is a food truck establishment,"{""category"":""food_truck"",""confidence"":1.0,""reason"":""MAC S SPEED SHOP is a food truck establishment""}"
MAC`S SPEED SHOP,2511 SOUTH BV,Charlotte,NC,,MAC S SPEED SHOP,,other,,food_truck,0.9,"Speed shop is a colloquial term for a food truck that serves quick, casual meals","{""category"":""food_truck"",""confidence"":0.9,""reason"":""Speed shop is a colloquial term for a food truck that serves quick, casual meals""}"
MAGGIANOS LITTLE ITALY,4400 SHARON RD,Charlotte,NC,,MAGGIANOS LITTLE ITALY,,other,,other,1.0,Italian restaurant,"{""category"":""italian"", ""confidence"":1.0, ""reason"":""Italian restaurant""}"
MAHANA FRESH BALLANTYNE,14815 BALLANTYNE VILLAGE WY,Charlotte,NC,,MAHANA FRESH BALLANTYNE,,other,,grocery_deli,0.8,Establishment type and location suggest a grocery store or deli,"{""category"":""grocery_deli"",""confidence"":0.8,""reason"":""Establishment type and location suggest a grocery store or deli""}"
MAIZ AGUA SAL TORTILLERIA,1018 JAY ST,Charlotte,NC,,MAIZ AGUA SAL TORTILLERIA,,other,,mexican,1.0,"Name contains 'MAIZ', 'AGUA', and 'SAL' which are common ingredients in Mexican cuisine","{""category"":""mexican"",""confidence"":1.0,""reason"":""Name contains 'MAIZ', 'AGUA', and 'SAL' which are common ingredients in Mexican cuisine""}"
MAL PAN SOUTHPARK,4625 PIEDMONT ROW DR,Charlotte,NC,,MAL PAN SOUTHPARK,,other,,fast_food_burger,0.8,Typical fast food burger joint,"{""category"":""fast_food_burger"",""confidence"":0.8,""reason"":""Typical fast food burger joint""}"
MAMA MIA TOO,101 N MAXWELL AV,Charlotte,NC,,MAMA MIA TOO,,other,,fast_food_pizza,0.8,Italian restaurant with pizza options,"{""category"":""fast_food_pizza"",""confidence"":0.8,""reason"":""Italian restaurant with pizza options""}"
MAMA RICOTTAS/GK,601 S KINGS DR,Charlotte,NC,,MAMA RICOTTAS/GK,,other,,other,0.8,Italian restaurant,"{""category"":""italian"", ""confidence"":0.8, ""reason"":""Italian restaurant""}"
MAMAKA BOWLS,200 W TREMONT AV,Charlotte,NC,,MAMAKA BOWLS,,other,,asian_chinese,0.8,Bowls is a common dish in Chinese cuisine,"{""category"":""asian_chinese"",""confidence"":0.8,""reason"":""Bowls is a common dish in Chinese cuisine""}"
MANHATTAN BAGEL,8040 PROVIDENCE RD,Charlotte,NC,,MANHATTAN BAGEL,,other,,bakery_cafe,1.0,bagel shop,"{""category"":""bakery_cafe"",""confidence"":1.0,""reason"":""bagel shop""}"
MANO BELLA ITALIAN ARTISAN FOOD,721 GOVERNOR MORRISON ST,Charlotte,NC,,MANO BELLA ITALIAN ARTISAN FOOD,,other,,other,0.9,Italian cuisine and 'artisan food' suggest Italian category,"{""category"":""italian"", ""confidence"":0.9, ""reason"":""Italian cuisine and 'artisan food' suggest Italian category""}"
MARGARITAS MOUNTAIN ISLAND,3818 CORNING PL,Charlotte,NC,,MARGARITAS MOUNTAIN ISLAND,,other,,bar,1.0,establishment serves alcoholic beverages,"{""category"":""bar"",""confidence"":1.0,""reason"":""establishment serves alcoholic beverages""}"
MARIPOSA,500 S TRYON ST,Charlotte,NC,,MARIPOSA,,other,,other,0.5,"No clear indication of food type, but 'MARIPOSA' is a restaurant name","{""category"":""other"",""confidence"":0.5,""reason"":""No clear indication of food type, but 'MARIPOSA' is a restaurant name""}"
MARISCOS NAYARIT,6023 ALBEMARLE RD,Charlotte,NC,,MARISCOS NAYARIT,,other,,mexican,1.0,establishment name and location suggest Mexican cuisine,"{""category"":""mexican"",""confidence"":1.0,""reason"":""establishment name and location suggest Mexican cuisine""}"
"MARQUEE LOUNGE, THE",3131 TUCKASEEGEE RD,Charlotte,NC,,MARQUEE LOUNGE,,other,,bar,0.8,Establishment name suggests lounge and bar atmosphere,"{""category"":""bar"",""confidence"":0.8,""reason"":""Establishment name suggests lounge and bar atmosphere""}"
MASALA MASTEE,107 N MAIN ST,Charlotte,NC,,MASALA MASTEE,,other,,other,0.0,unknown cuisine,"{""category"":""other"",""confidence"":0.0,""reason"":""unknown cuisine""}"
