premises_name,premise_address_1,premise_city,premise_state,premise_zip,clean_name,chain_name,business_type,business_type_manual,ollama_category,ollama_confidence,ollama_reason,ollama_raw
CLEAN EATZ,17111 KENTON DR,Charlotte,NC,,CLEAN EATZ,,other,,fast_food_burger,0.8,Typical burger joint name and location,"{""category"":""fast_food_burger"",""confidence"":0.8,""reason"":""Typical burger joint name and location""}"
CLEAN EATZ,2215 AYRSLEY TOWN BV,Charlotte,NC,,CLEAN EATZ,,other,,fast_food_burger,0.8,Typical fast food burger establishment,"{""category"":""fast_food_burger"",""confidence"":0.8,""reason"":""Typical fast food burger establishment""}"
CLEAN JUICE,2225 MATTHEWS TOWNSHIP PY,Charlotte,NC,,CLEAN JUICE,,other,,food_truck,0.8,Juice bar or smoothie truck,"{""category"":""food_truck"",""confidence"":0.8,""reason"":""Juice bar or smoothie truck""}"
CLEAN JUICE - BIRKDALE,16623 BIRKDALE COMMONS PY,Charlotte,NC,,CLEAN JUICE - BIRKDALE,,other,,food_truck,1.0,Juice bar,"{""category"":""food_truck"",""confidence"":1.0,""reason"":""Juice bar""}"
CLEAN JUICE DAVIDSON,605 JETTON ST,Charlotte,NC,,CLEAN JUICE DAVIDSON,,other,,food_truck,1.0,Juice bar,"{""category"":""food_truck"",""confidence"":1.0,""reason"":""Juice bar""}"
CLEAN JUICE REA FARMS,9826 SANDY ROCK PL,Charlotte,NC,,CLEAN JUICE REA FARMS,,other,,grocery_deli,0.8,Establishment appears to be a juice bar or farm-to-table market,"{""category"":""grocery_deli"",""confidence"":0.8,""reason"":""Establishment appears to be a juice bar or farm-to-table market""}"
CLEAN JUICE SOUTHEND,1616 CAMDEN RD,Charlotte,NC,,CLEAN JUICE SOUTHEND,,other,,food_truck,0.8,Juice bar or smoothie truck,"{""category"":""food_truck"",""confidence"":0.8,""reason"":""Juice bar or smoothie truck""}"
CLEAN JUICE STEELE CREEK,4833 BEREWICK TOWN CENTER DR,Charlotte,NC,,CLEAN JUICE STEELE CREEK,,other,,food_truck,1.0,Juice bar,"{""category"":""food_truck"",""confidence"":1.0,""reason"":""Juice bar""}"
CLEAN JUICE STONECREST,7918 REA RD,Charlotte,NC,,CLEAN JUICE STONECREST,,other,,food_truck,1.0,Juice bar,"{""category"":""food_truck"",""confidence"":1.0,""reason"":""Juice bar""}"
"CLUB CLT, THE",5501 JOSH BIRMINGHAM PY,Charlotte,NC,,CLUB CLT,,other,,bar,0.8,Establishment appears to be a bar or nightclub based on its name and location.,"{""category"":""bar"",""confidence"":0.8,""reason"":""Establishment appears to be a bar or nightclub based on its name and location.""}"
CLUB ONYX,5300 OLD PINEVILLE RD,Charlotte,NC,,CLUB ONYX,,other,,bar,1.0,establishment type indicated by name,"{""category"":""bar"",""confidence"":1.0,""reason"":""establishment type indicated by name""}"
CLUB WEST BREWING,2151 HAWKINS ST,Charlotte,NC,,CLUB WEST BREWING,,other,,bar,0.9,brewery and bar combination,"{""category"":""bar"",""confidence"":0.9,""reason"":""brewery and bar combination""}"
CO,4201 PARK RD,Charlotte,NC,,,,other,,other,0.0,short reason,"{""category"":""other"",""confidence"":0.0,""reason"":""short reason""}"
COASTERS,14523 CAROWINDS BV,Charlotte,NC,,COASTERS,,other,,fast_food_burger,0.8,Typical fast food restaurant chain with burger options,"{""category"":""fast_food_burger"",""confidence"":0.8,""reason"":""Typical fast food restaurant chain with burger options""}"
COCO & THE DIRECTOR,100 W TRADE ST,Charlotte,NC,,COCO & THE DIRECTOR,,other,,coffee_shop,0.8,contains coffee-related keywords in the name,"{""category"":""coffee_shop"",""confidence"":0.8,""reason"":""contains coffee-related keywords in the name""}"
COLLINS AEROSPACE,2730 W TYVOLA RD,Charlotte,NC,,COLLINS AEROSPACE,,other,,institutional,1.0,Establishment is a business (Collins Aerospace) located in a commercial building.,"{""category"":""institutional"",""confidence"":1.0,""reason"":""Establishment is a business (Collins Aerospace) located in a commercial building.""}"
COMFORT INN & SUITES,19521 LIVERPOOL PY,Charlotte,NC,,COMFORT INN & SUITES,,other,,institutional,1.0,Hotel,"{""category"":""institutional"",""confidence"":1.0,""reason"":""Hotel""}"
COMFORT INN MATTHEWS,1718 WINDSOR CROSSING DR,Charlotte,NC,,COMFORT INN MATTHEWS,,other,,institutional,1.0,hotel,"{""category"":""institutional"",""confidence"":1.0,""reason"":""hotel""}"
COMFORT SUITES,16905 CALDWELL CREEK DR,Charlotte,NC,,COMFORT SUITES,,other,,institutional,1.0,Hotel,"{""category"":""institutional"",""confidence"":1.0,""reason"":""Hotel""}"
COMFORT SUITES,7735 UNIVERSITY CITY BV,Charlotte,NC,,COMFORT SUITES,,other,,institutional,1.0,Hotel,"{""category"":""institutional"",""confidence"":1.0,""reason"":""Hotel""}"
COMFORT SUITES #391,3425 MULBERRY CHURCH RD,Charlotte,NC,,COMFORT SUITES,,other,,institutional,1.0,Hotel,"{""category"":""institutional"",""confidence"":1.0,""reason"":""Hotel""}"
COMFORT SUITES NORTHLAKE,7315 SMITH CORNERS BV,Charlotte,NC,,COMFORT SUITES NORTHLAKE,,other,,institutional,1.0,Hotel,"{""category"":""institutional"",""confidence"":1.0,""reason"":""Hotel""}"
COMFORT SUITES PINEVILLE,10415 CENTRUM PY,Charlotte,NC,,COMFORT SUITES PINEVILLE,,other,,institutional,1.0,hotel,"{""category"":""institutional"",""confidence"":1.0,""reason"":""hotel""}"
COMMONSPACE,5501 JOSH BIRMINGHAM PY,Charlotte,NC,,COMMONSPACE,,other,,other,0.8,"No clear indication of food type, may be a venue or event space","{""category"":""other"",""confidence"":0.8,""reason"":""No clear indication of food type, may be a venue or event space""}"
COMMUNITY CULINARY SCHOOL/ ENCORE CATERING,9315 MONROE RD,Charlotte,NC,,COMMUNITY CULINARY SCHOOL/ ENCORE CATERING,,other,,institutional,1.0,school/hospital/venue/cafeteria,"{""category"":""institutional"",""confidence"":1.0,""reason"":""school/hospital/venue/cafeteria""}"
COMO EN MEXICO,1125 E SUGAR CREEK RD,Charlotte,NC,,COMO EN MEXICO,,other,,fast_food_mexican,0.8,Mexican food establishment,"{""category"":""fast_food_mexican"",""confidence"":0.8,""reason"":""Mexican food establishment""}"
COMPASS/WELLS FARGO BREVARD,300 S BREVARD ST,Charlotte,NC,,COMPASS/WELLS FARGO BREVARD,,other,,institutional,1.0,bank/financial institution,"{""category"":""institutional"",""confidence"":1.0,""reason"":""bank/financial institution""}"
COMPASS/WELLS FARGO EMERALD COMMONS,1525 W W T HARRIS BV,Charlotte,NC,,COMPASS/WELLS FARGO EMERALD COMMONS,,other,,institutional,1.0,hotel,"{""category"":""institutional"",""confidence"":1.0,""reason"":""hotel""}"
CONSPIRACY,412 W 5TH ST,Charlotte,NC,,CONSPIRACY,,other,,other,0.0,short reason,"{""category"":""other"",""confidence"":0.0,""reason"":""short reason""}"
CONVENTION CENTER/BANQUET KIT,501 S COLLEGE ST,Charlotte,NC,,CONVENTION CENTER/BANQUET KIT,,other,,institutional,1.0,venue/catering facility,"{""category"":""institutional"",""confidence"":1.0,""reason"":""venue/catering facility""}"
"COOKING POT, THE",5622 E INDEPENDENCE BV,Charlotte,NC,,COOKING POT,,other,,other,0.8,Restaurant or food establishment could not be classified into a specific category based on the provided information.,"{""category"":""other"",""confidence"":0.8,""reason"":""Restaurant or food establishment could not be classified into a specific category based on the provided information.""}"
COOL FISH,21726 CATAWBA AV,Charlotte,NC,,COOL FISH,,other,,seafood,1.0,establishment name contains 'COOL FISH',"{""category"":""seafood"",""confidence"":1.0,""reason"":""establishment name contains 'COOL FISH'""}"
COPPER,311 EAST BV,Charlotte,NC,,COPPER,,other,,other,0.0,unknown establishment type,"{""category"":""other"",""confidence"":0.0,""reason"":""unknown establishment type""}"
COQUETTE,400 S TRYON ST,Charlotte,NC,,COQUETTE,,other,,bar,1.0,"COQUETTE is a bar and lounge located in Charlotte, NC","{""category"":""bar"",""confidence"":1.0,""reason"":""COQUETTE is a bar and lounge located in Charlotte, NC""}"
COSTA DEL SOL,8045 SOUTH BV,Charlotte,NC,,COSTA DEL SOL,,other,,fast_food_burger,0.8,Typical fast food chain name,"{""category"":""fast_food_burger"",""confidence"":0.8,""reason"":""Typical fast food chain name""}"
COSTA DEL SOL,809 E ARROWOOD RD,Charlotte,NC,,COSTA DEL SOL,,other,,fast_food_burger,0.8,Typical fast food chain name,"{""category"":""fast_food_burger"",""confidence"":0.8,""reason"":""Typical fast food chain name""}"
COSTA DEL SOL PINEVILLE,10215 PARK RD,Charlotte,NC,,COSTA DEL SOL PINEVILLE,,other,,other,0.8,"Restaurant or cafe with a specific name, but no clear indication of cuisine type","{""category"":""other"",""confidence"":0.8,""reason"":""Restaurant or cafe with a specific name, but no clear indication of cuisine type""}"
COSTCO #367 FOOD COURT,2125 MATTHEWS TOWNSHIP PY,Charlotte,NC,,COSTCO FOOD COURT,,other,,grocery_deli,0.9,Food court within a grocery store,"{""category"":""grocery_deli"",""confidence"":0.9,""reason"":""Food court within a grocery store""}"
COTTAGE,6701 N TRYON ST,Charlotte,NC,,COTTAGE,,other,,other,0.0,short reason,"{""category"":""other"",""confidence"":0.0,""reason"":""short reason""}"
COTTAGE,7705 S TRYON ST,Charlotte,NC,,COTTAGE,,other,,other,0.0,short reason,"{""category"":""other"",""confidence"":0.0,""reason"":""short reason""}"
COTTAGE EXPRESS,7209 E W T HARRIS BV,Charlotte,NC,,COTTAGE EXPRESS,,other,,fast_food_burger,0.8,Typical fast food burger establishment,"{""category"":""fast_food_burger"",""confidence"":0.8,""reason"":""Typical fast food burger establishment""}"
COUNTER,2001 W MOREHEAD ST,Charlotte,NC,,COUNTER,,other,,fast_food_burger,0.9,Typical fast food restaurant name and location,"{""category"":""fast_food_burger"",""confidence"":0.9,""reason"":""Typical fast food restaurant name and location""}"
COUNTRY INN & SUITES,16617 STATESVILLE RD,Charlotte,NC,,COUNTRY INN & SUITES,,other,,institutional,1.0,hotel,"{""category"":""institutional"",""confidence"":1.0,""reason"":""hotel""}"
COUNTRY INN & SUITES BY RADISSON,2541 LITTLE ROCK RD,Charlotte,NC,,COUNTRY INN & SUITES BY RADISSON,,other,,full_service,0.9,hotel,"{""category"":""full_service"",""confidence"":0.9,""reason"":""hotel""}"
COUNTRY INN AND SUITES CHARLOTTE UNIVERSITY,131 E MCCULLOUGH DR,Charlotte,NC,,COUNTRY INN AND SUITES CHARLOTTE UNIVERSITY,,other,,institutional,1.0,hotel,"{""category"":""institutional"",""confidence"":1.0,""reason"":""hotel""}"
COURTYARD BY MARRIOTT,8536 OUTLETS BV,Charlotte,NC,,COURTYARD BY MARRIOTT,,other,,institutional,1.0,Hotel,"{""category"":""institutional"",""confidence"":1.0,""reason"":""Hotel""}"
COURTYARD BY MARRIOTT BALLANTYNE,15635 DON LOCHMAN LN,Charlotte,NC,,COURTYARD BY MARRIOTT BALLANTYNE,,other,,institutional,1.0,hotel,"{""category"":""institutional"",""confidence"":1.0,""reason"":""hotel""}"
COURTYARD BY MARRIOTT CHARLOTTE ARROWOOD,800 W ARROWOOD RD,Charlotte,NC,,COURTYARD BY MARRIOTT CHARLOTTE ARROWOOD,,other,,institutional,1.0,Hotel,"{""category"":""institutional"",""confidence"":1.0,""reason"":""Hotel""}"
COURTYARD CHARLOTTE WAVERLY,6319 PROVIDENCE FARM LN,Charlotte,NC,,COURTYARD CHARLOTTE WAVERLY,,other,,other,0.0,short reason,"{""category"":""other"",""confidence"":0.0,""reason"":""short reason""}"
COURTYARD MARRIOT,2700 LITTLE ROCK RD,Charlotte,NC,,COURTYARD MARRIOT,,other,,full_service,1.0,hotel,"{""category"":""full_service"",""confidence"":1.0,""reason"":""hotel""}"
COVENANT PRESBYTERIAN CHURCH,1000 E MOREHEAD ST,Charlotte,NC,,COVENANT PRESBYTERIAN CHURCH,,other,,institutional,1.0,church,"{""category"":""institutional"",""confidence"":1.0,""reason"":""church""}"
COWBELL,201 N TRYON ST,Charlotte,NC,,COWBELL,,other,,fast_food_burger,1.0,Typical burger joint name and location,"{""category"":""fast_food_burger"",""confidence"":1.0,""reason"":""Typical burger joint name and location""}"
"COWFISH, THE",4310 SHARON RD,Charlotte,NC,,COWFISH,,other,,seafood,1.0,"establishment name contains 'COWFISH', indicating a seafood restaurant","{""category"":""seafood"",""confidence"":1.0,""reason"":""establishment name contains 'COWFISH', indicating a seafood restaurant""}"
CRACKIN CRAWFISH,440 E MCCULLOUGH DR,Charlotte,NC,,CRACKIN CRAWFISH,,other,,seafood,1.0,crackin crawfish is a seafood restaurant,"{""category"":""seafood"",""confidence"":1.0,""reason"":""crackin crawfish is a seafood restaurant""}"
CRAFT ON 14 TRUIST CENTER,214 N TRYON ST,Charlotte,NC,,CRAFT ON TRUIST CENTER,,other,,other,0.5,"Specialty food and drink establishment, but not clearly categorized","{""category"":""other"",""confidence"":0.5,""reason"":""Specialty food and drink establishment, but not clearly categorized""}"
CRAFT TASTING ROOM GROWLER SHOP,1320 S CHURCH ST,Charlotte,NC,,CRAFT TASTING ROOM GROWLER SHOP,,other,,other,1.0,craft tasting room and growler shop does not fit into any of the provided categories,"{""category"":""other"",""confidence"":1.0,""reason"":""craft tasting room and growler shop does not fit into any of the provided categories""}"
CRAFTY BURGR N TAP,17015 KENTON DR,Charlotte,NC,,CRAFTY BURGR N TAP,,other,,fast_food_burger,1.0,Typical characteristics of a burger restaurant,"{""category"":""fast_food_burger"",""confidence"":1.0,""reason"":""Typical characteristics of a burger restaurant""}"
CRAFTY BURGR N TAP ANTIQUITY,21726 CATAWBA AV,Charlotte,NC,,CRAFTY BURGR N TAP ANTIQUITY,,other,,fast_food_burger,1.0,Typical fast food burger establishment,"{""category"":""fast_food_burger"",""confidence"":1.0,""reason"":""Typical fast food burger establishment""}"
CRAZY HORSE SHOWCLUB,5321 E INDEPENDENCE BV,Charlotte,NC,,CRAZY HORSE SHOWCLUB,,other,,other,0.0,not enough information available,"{""category"":""other"",""confidence"":0.0,""reason"":""not enough information available""}"
"CRAZY PIG, THE",402 S MAIN ST,Charlotte,NC,,CRAZY PIG,,other,,fast_food_pizza,0.8,pizza establishment,"{""category"":""fast_food_pizza"",""confidence"":0.8,""reason"":""pizza establishment""}"
CREATIVE CATERING,1401 ALLEN ST,Charlotte,NC,,CREATIVE CATERING,,other,,other,0.0,uncertain,"{""category"":""other"",""confidence"":0.0,""reason"":""uncertain""}"
CRISPY BANH MI,2130 AYRSLEY TOWN BV,Charlotte,NC,,CRISPY BANH MI,,other,,fast_food_mexican,1.0,Vietnamese fast food restaurant specializing in banh mi sandwiches,"{""category"":""fast_food_mexican"",""confidence"":1.0,""reason"":""Vietnamese fast food restaurant specializing in banh mi sandwiches""}"
CRISPY BANH MI,2934 SHAMROCK DR,Charlotte,NC,,CRISPY BANH MI,,other,,fast_food_mexican,0.8,"Vietnamese cuisine is often associated with Mexican food, and 'banh mi' is a popular Vietnamese sandwich","{""category"":""fast_food_mexican"",""confidence"":0.8,""reason"":""Vietnamese cuisine is often associated with Mexican food, and 'banh mi' is a popular Vietnamese sandwich""}"
CRISPY BANH MI,5100 SOUTH BV,Charlotte,NC,,CRISPY BANH MI,,other,,fast_food_mexican,1.0,Vietnamese cuisine typically associated with Mexican food,"{""category"":""fast_food_mexican"",""confidence"":1.0,""reason"":""Vietnamese cuisine typically associated with Mexican food""}"
CRISPY BANH MI #4,14825 BALLANTYNE VILLAGE WY,Charlotte,NC,,CRISPY BANH MI,,other,,fast_food_mexican,1.0,Vietnamese cuisine typically associated with Mexican food,"{""category"":""fast_food_mexican"",""confidence"":1.0,""reason"":""Vietnamese cuisine typically associated with Mexican food""}"
CRU,3428 N TRYON ST,Charlotte,NC,,CRU,,other,,bbq,1.0,,"{""category"":""bbq"",""confidence"":1.0}"
"CRUNKLETON, THE",1957 E 7TH ST,Charlotte,NC,,CRUNKLETON,,other,,other,0.9,Restaurant or bar name not found in database,"{""category"":""other"",""confidence"":0.9,""reason"":""Restaurant or bar name not found in database""}"
CULINARY DROPOUT,1120 S TRYON ST,Charlotte,NC,,CULINARY DROPOUT,,other,,other,1.0,No clear indication of food type or cuisine,"{""category"":""other"",""confidence"":1.0,""reason"":""No clear indication of food type or cuisine""}"
"CULTURE SHOP, THE",1425 KENNON ST,Charlotte,NC,,CULTURE SHOP,,other,,other,0.8,Cultural or community-focused store,"{""category"":""other"",""confidence"":0.8,""reason"":""Cultural or community-focused store""}"
CULVERS OF CHARLOTTE,7031 UNIVERSITY CITY BV,Charlotte,NC,,CULVERS OF CHARLOTTE,,other,,fast_food_burger,0.9,Typical fast food burger chain,"{""category"":""fast_food_burger"",""confidence"":0.9,""reason"":""Typical fast food burger chain""}"
CURRY GATE,630 W 24TH ST,Charlotte,NC,,CURRY GATE,,other,,mexican,0.8,Indian restaurant often found in Mexican cuisine,"{""category"":""mexican"",""confidence"":0.8,""reason"":""Indian restaurant often found in Mexican cuisine""}"
CURRY GATE 2,5516 SOUTH BV,Charlotte,NC,,CURRY GATE,,other,,other,0.9,Indian restaurant not explicitly listed in categories,"{""category"":""other"",""confidence"":0.9,""reason"":""Indian restaurant not explicitly listed in categories""}"
CURRY JUNCTION,8200 PROVIDENCE RD,Charlotte,NC,,CURRY JUNCTION,,other,,mexican,1.0,"CURRY JUNCTION is a common name for Indian or Southeast Asian restaurants, and 'junction' suggests a casual dining experience typical of Mexican cuisine.","{""category"":""mexican"",""confidence"":1.0,""reason"":""CURRY JUNCTION is a common name for Indian or Southeast Asian restaurants, and 'junction' suggests a casual dining experience typical of Mexican cuisine.""}"
"CUSTOMSHOP, THE",1601 ELIZABETH AV,Charlotte,NC,,CUSTOMSHOP,,other,,other,0.8,No clear indication of food type,"{""category"":""other"",""confidence"":0.8,""reason"":""No clear indication of food type""}"
CUZCATLAN,4800 CENTRAL AV,Charlotte,NC,,CUZCATLAN,,other,,mexican,1.0,CUZCATLAN is a Mexican restaurant based on its name and location.,"{""category"":""mexican"",""confidence"":1.0,""reason"":""CUZCATLAN is a Mexican restaurant based on its name and location.""}"
CUZZOS CUISINE II,9601 N TRYON ST,Charlotte,NC,,CUZZOS CUISINE II,,other,,fast_food_mexican,0.8,Mexican food establishment,"{""category"":""fast_food_mexican"",""confidence"":0.8,""reason"":""Mexican food establishment""}"
D.D. PECKERS WING SHACK,10403 PARK RD,Charlotte,NC,,D D PECKERS WING SHACK,,other,,fast_food_chicken,1.0,Typical chicken wing joint,"{""category"":""fast_food_chicken"",""confidence"":1.0,""reason"":""Typical chicken wing joint""}"
DAHLIAS,123 E 5TH ST,Charlotte,NC,,DAHLIAS,,other,,other,0.8,"No clear indication of food type, likely a restaurant or bar","{""category"":""other"",""confidence"":0.8,""reason"":""No clear indication of food type, likely a restaurant or bar""}"
"DAILY, THE",214 N CHURCH ST,Charlotte,NC,,DAILY,,other,,other,1.0,No clear indication of food type,"{""category"":""other"",""confidence"":1.0,""reason"":""No clear indication of food type""}"
DAIRY QUEEN,108 S SHARON AMITY RD,Charlotte,NC,,DAIRY QUEEN,,other,,fast_food_burger,1.0,DAIRY QUEEN is a well-known fast food burger chain,"{""category"":""fast_food_burger"",""confidence"":1.0,""reason"":""DAIRY QUEEN is a well-known fast food burger chain""}"
DAIRY QUEEN #11603,1819 MATTHEWS TOWNSHIP PY,Charlotte,NC,,DAIRY QUEEN,,other,,fast_food_burger,1.0,DAIRY QUEEN is a well-known fast food burger chain,"{""category"":""fast_food_burger"",""confidence"":1.0,""reason"":""DAIRY QUEEN is a well-known fast food burger chain""}"
DAIRY QUEEN #12404,3020 PROSPERITY CHURCH RD,Charlotte,NC,,DAIRY QUEEN,,other,,fast_food_burger,1.0,DAIRY QUEEN is a well-known fast food burger chain,"{""category"":""fast_food_burger"",""confidence"":1.0,""reason"":""DAIRY QUEEN is a well-known fast food burger chain""}"
DAIRY QUEEN EASTWAY #17165,3054 EASTWAY DR,Charlotte,NC,,DAIRY QUEEN EASTWAY,,other,,fast_food_burger,1.0,Dairy Queen is a fast-food burger chain,"{""category"":""fast_food_burger"",""confidence"":1.0,""reason"":""Dairy Queen is a fast-food burger chain""}"
DAVE AND BUSTERS,11049 CAROLINA PLACE PY,Charlotte,NC,,DAVE AND BUSTERS,,other,,sports_bar,0.9,entertainment venue with food and drinks,"{""category"":""sports_bar"",""confidence"":0.9,""reason"":""entertainment venue with food and drinks""}"
DAVIDSON SODA SHOP,104 S MAIN ST,Charlotte,NC,,DAVIDSON SODA SHOP,,other,,coffee_shop,0.8,Soda Shop often serves coffee and other beverages,"{""category"":""coffee_shop"",""confidence"":0.8,""reason"":""Soda Shop often serves coffee and other beverages""}"
DAVIDSON VILLAGE INN,117 DEPOT ST,Charlotte,NC,,DAVIDSON VILLAGE INN,,other,,institutional,1.0,hotel,"{""category"":""institutional"",""confidence"":1.0,""reason"":""hotel""}"
DEFY CHARLOTTE,8116 UNIVERSITY CITY BV,Charlotte,NC,,DEFY CHARLOTTE,,other,,fast_food_burger,0.8,Typical fast food burger chain location,"{""category"":""fast_food_burger"",""confidence"":0.8,""reason"":""Typical fast food burger chain location""}"
"DEGENERATE, THE",2116 N DAVIDSON ST,Charlotte,NC,,DEGENERATE,,other,,bar,1.0,establishment name suggests a bar or nightlife venue,"{""category"":""bar"",""confidence"":1.0,""reason"":""establishment name suggests a bar or nightlife venue""}"
DELTA SKY CLUB- CONCOURSE A,5501 JOSH BIRMINGHAM PY,Charlotte,NC,,DELTA SKY CLUB- CONCOURSE A,,other,,institutional,0.9,hotel/concourse,"{""category"":""institutional"",""confidence"":0.9,""reason"":""hotel/concourse""}"
DELUXE THE FUN ART OF DINING,305 W 4TH ST,Charlotte,NC,,DELUXE THE FUN ART OF DINING,,other,,other,0.8,"Upscale dining experience, no clear indication of specific cuisine or type","{""category"":""other"",""confidence"":0.8,""reason"":""Upscale dining experience, no clear indication of specific cuisine or type""}"
DENNYS #7646,4541 SUNSET RD,Charlotte,NC,,DENNYS,,other,,fast_food_burger,0.8,Typical fast food burger joint,"{""category"":""fast_food_burger"",""confidence"":0.8,""reason"":""Typical fast food burger joint""}"
DEVON & BLAKELY,101 S TRYON ST,Charlotte,NC,,DEVON & BLAKELY,,other,,bbq,0.8,BBQ joint,"{""category"":""bbq"",""confidence"":0.8,""reason"":""BBQ joint""}"
DILWORTH TASTING ROOM,300 E TREMONT AV,Charlotte,NC,,DILWORTH TASTING ROOM,,other,,other,0.8,Restaurant or tasting room not clearly categorized,"{""category"":""other"",""confidence"":0.8,""reason"":""Restaurant or tasting room not clearly categorized""}"
DILWORTH TASTING ROOM SOUTHPARK,4905 ASHLEY PARK LN,Charlotte,NC,,DILWORTH TASTING ROOM SOUTHPARK,,other,,other,0.8,Restaurant or tasting room without clear indication of cuisine type,"{""category"":""other"",""confidence"":0.8,""reason"":""Restaurant or tasting room without clear indication of cuisine type""}"
DINOS,350 E SUGAR CREEK RD,Charlotte,NC,,DINOS,,other,,fast_food_burger,0.8,Typical fast food burger joint,"{""category"":""fast_food_burger"",""confidence"":0.8,""reason"":""Typical fast food burger joint""}"
DISH,1220 THOMAS AV,Charlotte,NC,,DISH,,other,,fast_food_chicken,1.0,based on the name 'DISH' which is commonly associated with chicken restaurants,"{""category"":""fast_food_chicken"",""confidence"":1.0,""reason"":""based on the name 'DISH' which is commonly associated with chicken restaurants""}"
DISTRICT 57,1526 ALLEGHANY ST,Charlotte,NC,,DISTRICT,,other,,other,0.8,"No clear indication of food type, likely a non-food establishment","{""category"":""other"",""confidence"":0.8,""reason"":""No clear indication of food type, likely a non-food establishment""}"
DIVE N,109 N POLK ST,Charlotte,NC,,DIVE N,,other,,other,1.0,No clear indication of food type,"{""category"":""other"",""confidence"":1.0,""reason"":""No clear indication of food type""}"
DOGWOOD,601 S COLLEGE ST,Charlotte,NC,,DOGWOOD,,other,,other,1.0,No clear indication of food type,"{""category"":""other"",""confidence"":1.0,""reason"":""No clear indication of food type""}"
DOLCE OSTERIA,1710 KENILWORTH AV,Charlotte,NC,,DOLCE OSTERIA,,other,,other,0.8,Italian restaurant name and location,"{""category"":""italian"", ""confidence"":0.8, ""reason"":""Italian restaurant name and location""}"
DON'S,321 N CALDWELL ST,Charlotte,NC,,DON S,,other,,fast_food_burger,1.0,DON S is a fast food burger joint,"{""category"":""fast_food_burger"",""confidence"":1.0,""reason"":""DON S is a fast food burger joint""}"
DORCHESTER,12930 DORMAN RD,Charlotte,NC,,DORCHESTER,,other,,other,0.0,short reason,"{""category"":""other"",""confidence"":0.0,""reason"":""short reason""}"
DOS CAMINOS,601 S TRYON ST,Charlotte,NC,,DOS CAMINOS,,other,,mexican,1.0,DOS CAMINOS is a Mexican restaurant,"{""category"":""mexican"",""confidence"":1.0,""reason"":""DOS CAMINOS is a Mexican restaurant""}"
DOT DOT DOT,4237 PARK RD,Charlotte,NC,,DOT DOT DOT,,other,,other,1.0,No specific category available,"{""category"":""other"",""confidence"":1.0,""reason"":""No specific category available""}"
DOUBLETREE SUITES BY HILTON CHARLOTTE SOUTHPARK,6300 CARNEGIE BV,Charlotte,NC,,DOUBLETREE SUITES BY HILTON CHARLOTTE SOUTHPARK,,other,,institutional,1.0,Hotel,"{""category"":""institutional"",""confidence"":1.0,""reason"":""Hotel""}"
DR. CHARLES L. SIFFORD GOLF COURSE,1225 REMOUNT RD,Charlotte,NC,,DR CHARLES L SIFFORD GOLF COURSE,,other,,other,0.0,golf course,"{""category"":""other"",""confidence"":0.0,""reason"":""golf course""}"
DRAGON BUFFET,8170 S TRYON ST,Charlotte,NC,,DRAGON BUFFET,,other,,buffet,1.0,buffet,"{""category"":""buffet"",""confidence"":1.0,""reason"":"" buffet""}"
DRURY INN & SUITES,415 W W T HARRIS BV,Charlotte,NC,,DRURY INN & SUITES,,other,,institutional,1.0,hotel,"{""category"":""institutional"",""confidence"":1.0,""reason"":""hotel""}"
DRURY INN & SUITES CHARLOTTE ARROWOOD,8925 RED OAK BV,Charlotte,NC,,DRURY INN & SUITES CHARLOTTE ARROWOOD,,other,,institutional,1.0,hotel,"{""category"":""institutional"",""confidence"":1.0,""reason"":""hotel""}"
DRURY INN AND SUITES,6920 NORTHLAKE MALL DR,Charlotte,NC,,DRURY INN AND SUITES,,other,,institutional,1.0,hotel,"{""category"":""institutional"",""confidence"":1.0,""reason"":""hotel""}"
DTR PLAZA MIDWOOD,1413 CENTRAL AV,Charlotte,NC,,DTR PLAZA MIDWOOD,,other,,other,0.8,"No clear indication of food type, likely a venue or event space","{""category"":""other"",""confidence"":0.8,""reason"":""No clear indication of food type, likely a venue or event space""}"
DUCK DONUTS,1710 KENILWORTH AV,Charlotte,NC,,DUCK DONUTS,,other,,food_truck,1.0,Duck Donuts is a mobile donut shop,"{""category"":""food_truck"",""confidence"":1.0,""reason"":""Duck Donuts is a mobile donut shop""}"
